{
  "v": 1,
  "run": {
    "id": "7260b96c15d24da1af7bfdfb4af6c765",
    "started": "2026-07-29T09:19:28.9724532Z",
    "ended": "2026-07-29T09:19:58.6316644Z",
    "duration_seconds": 29.6563638,
    "exit": 0,
    "dry_run": false,
    "durability": "logical",
    "audit": "ok",
    "source": "D:\\bigcp-bench\\2026-07-29\\src-1011d35dcdec\\w1-small",
    "destination": "C:\\Users\\shitals\\AppData\\Local\\Temp\\bigcp-bench-dst-1011d35dcdec\\w1-bigcp",
    "log_path": "\\\\?\\C:\\Users\\shitals\\AppData\\Local\\Temp\\bigcp-bench-dst-1011d35dcdec\\reports\\w1-bigcp.log.jsonl",
    "report_path": "\\\\?\\C:\\Users\\shitals\\AppData\\Local\\Temp\\bigcp-bench-dst-1011d35dcdec\\reports\\w1-bigcp.report.json"
  },
  "config": {
    "analyze": false,
    "destination_profile": "auto",
    "dry_run": false,
    "flush": false,
    "fresh": false,
    "include_system": false,
    "log_schema": 1,
    "no_sparse": false,
    "raw_reparse": false,
    "replace": true,
    "skip_cloud": false,
    "source_profile": "auto",
    "tune": {
      "checkpoint_threshold": null,
      "chunk_bytes": null,
      "large_threshold": null,
      "memory_bytes": null,
      "streams": null,
      "threads": null
    },
    "verify": false
  },
  "devices": {
    "source": {
      "class": "unknown",
      "confidence": "high",
      "chunk_bytes": 4194304,
      "streams": 1,
      "workers": 4,
      "enumeration_threads": 4
    },
    "destination": {
      "class": "unknown",
      "confidence": "high",
      "chunk_bytes": 4194304,
      "streams": 1,
      "workers": 4,
      "enumeration_threads": 4
    },
    "chunk_bytes": 2097152,
    "streams": 1,
    "workers": 4,
    "same_physical_disk": false
  },
  "counters": {
    "files_discovered": 20000,
    "copied_new": 20000,
    "copied_replaced": 0,
    "skipped_same": 0,
    "skipped_diff": 0,
    "meta_fixed": 0,
    "failed": 0,
    "excluded": 0,
    "not_attempted": 0,
    "would_copy_new": 0,
    "would_copy_replaced": 0,
    "would_meta_fix": 0,
    "extra": 0,
    "dirs_discovered": 21,
    "dir_done": 21,
    "dirs_meta_failed": 0,
    "dirs_failed": 0,
    "dirs_excluded": 0,
    "dirs_planned": 0,
    "links_discovered": 0,
    "links_copied": 0,
    "links_failed": 0,
    "links_excluded": 0,
    "links_not_attempted": 0,
    "links_skipped": 0,
    "links_planned": 0,
    "bytes_enumerated": 81920000,
    "bytes_logical_discovered": 81920000,
    "bytes_logical_copied": 81920000,
    "bytes_read_source": 81920000,
    "bytes_written_destination": 81920000,
    "bytes_verified": 0
  },
  "replacements": {
    "count": 0,
    "bytes": 0,
    "destination_newer": 0,
    "by_folder": {},
    "samples": []
  },
  "errors": [],
  "warnings": {},
  "extras": {
    "count": 0,
    "samples": []
  },
  "folders": {
    "dir00": {
      "files_discovered": 1000,
      "copied_new": 1000,
      "copied_replaced": 0,
      "skipped_same": 0,
      "skipped_diff": 0,
      "meta_fixed": 0,
      "failed": 0,
      "excluded": 0,
      "not_attempted": 0,
      "logical_bytes_discovered": 4096000,
      "logical_bytes_copied": 4096000
    },
    "dir01": {
      "files_discovered": 1000,
      "copied_new": 1000,
      "copied_replaced": 0,
      "skipped_same": 0,
      "skipped_diff": 0,
      "meta_fixed": 0,
      "failed": 0,
      "excluded": 0,
      "not_attempted": 0,
      "logical_bytes_discovered": 4096000,
      "logical_bytes_copied": 4096000
    },
    "dir02": {
      "files_discovered": 1000,
      "copied_new": 1000,
      "copied_replaced": 0,
      "skipped_same": 0,
      "skipped_diff": 0,
      "meta_fixed": 0,
      "failed": 0,
      "excluded": 0,
      "not_attempted": 0,
      "logical_bytes_discovered": 4096000,
      "logical_bytes_copied": 4096000
    },
    "dir03": {
      "files_discovered": 1000,
      "copied_new": 1000,
      "copied_replaced": 0,
      "skipped_same": 0,
      "skipped_diff": 0,
      "meta_fixed": 0,
      "failed": 0,
      "excluded": 0,
      "not_attempted": 0,
      "logical_bytes_discovered": 4096000,
      "logical_bytes_copied": 4096000
    },
    "dir04": {
      "files_discovered": 1000,
      "copied_new": 1000,
      "copied_replaced": 0,
      "skipped_same": 0,
      "skipped_diff": 0,
      "meta_fixed": 0,
      "failed": 0,
      "excluded": 0,
      "not_attempted": 0,
      "logical_bytes_discovered": 4096000,
      "logical_bytes_copied": 4096000
    },
    "dir05": {
      "files_discovered": 1000,
      "copied_new": 1000,
      "copied_replaced": 0,
      "skipped_same": 0,
      "skipped_diff": 0,
      "meta_fixed": 0,
      "failed": 0,
      "excluded": 0,
      "not_attempted": 0,
      "logical_bytes_discovered": 4096000,
      "logical_bytes_copied": 4096000
    },
    "dir06": {
      "files_discovered": 1000,
      "copied_new": 1000,
      "copied_replaced": 0,
      "skipped_same": 0,
      "skipped_diff": 0,
      "meta_fixed": 0,
      "failed": 0,
      "excluded": 0,
      "not_attempted": 0,
      "logical_bytes_discovered": 4096000,
      "logical_bytes_copied": 4096000
    },
    "dir07": {
      "files_discovered": 1000,
      "copied_new": 1000,
      "copied_replaced": 0,
      "skipped_same": 0,
      "skipped_diff": 0,
      "meta_fixed": 0,
      "failed": 0,
      "excluded": 0,
      "not_attempted": 0,
      "logical_bytes_discovered": 4096000,
      "logical_bytes_copied": 4096000
    },
    "dir08": {
      "files_discovered": 1000,
      "copied_new": 1000,
      "copied_replaced": 0,
      "skipped_same": 0,
      "skipped_diff": 0,
      "meta_fixed": 0,
      "failed": 0,
      "excluded": 0,
      "not_attempted": 0,
      "logical_bytes_discovered": 4096000,
      "logical_bytes_copied": 4096000
    },
    "dir09": {
      "files_discovered": 1000,
      "copied_new": 1000,
      "copied_replaced": 0,
      "skipped_same": 0,
      "skipped_diff": 0,
      "meta_fixed": 0,
      "failed": 0,
      "excluded": 0,
      "not_attempted": 0,
      "logical_bytes_discovered": 4096000,
      "logical_bytes_copied": 4096000
    },
    "dir10": {
      "files_discovered": 1000,
      "copied_new": 1000,
      "copied_replaced": 0,
      "skipped_same": 0,
      "skipped_diff": 0,
      "meta_fixed": 0,
      "failed": 0,
      "excluded": 0,
      "not_attempted": 0,
      "logical_bytes_discovered": 4096000,
      "logical_bytes_copied": 4096000
    },
    "dir11": {
      "files_discovered": 1000,
      "copied_new": 1000,
      "copied_replaced": 0,
      "skipped_same": 0,
      "skipped_diff": 0,
      "meta_fixed": 0,
      "failed": 0,
      "excluded": 0,
      "not_attempted": 0,
      "logical_bytes_discovered": 4096000,
      "logical_bytes_copied": 4096000
    },
    "dir12": {
      "files_discovered": 1000,
      "copied_new": 1000,
      "copied_replaced": 0,
      "skipped_same": 0,
      "skipped_diff": 0,
      "meta_fixed": 0,
      "failed": 0,
      "excluded": 0,
      "not_attempted": 0,
      "logical_bytes_discovered": 4096000,
      "logical_bytes_copied": 4096000
    },
    "dir13": {
      "files_discovered": 1000,
      "copied_new": 1000,
      "copied_replaced": 0,
      "skipped_same": 0,
      "skipped_diff": 0,
      "meta_fixed": 0,
      "failed": 0,
      "excluded": 0,
      "not_attempted": 0,
      "logical_bytes_discovered": 4096000,
      "logical_bytes_copied": 4096000
    },
    "dir14": {
      "files_discovered": 1000,
      "copied_new": 1000,
      "copied_replaced": 0,
      "skipped_same": 0,
      "skipped_diff": 0,
      "meta_fixed": 0,
      "failed": 0,
      "excluded": 0,
      "not_attempted": 0,
      "logical_bytes_discovered": 4096000,
      "logical_bytes_copied": 4096000
    },
    "dir15": {
      "files_discovered": 1000,
      "copied_new": 1000,
      "copied_replaced": 0,
      "skipped_same": 0,
      "skipped_diff": 0,
      "meta_fixed": 0,
      "failed": 0,
      "excluded": 0,
      "not_attempted": 0,
      "logical_bytes_discovered": 4096000,
      "logical_bytes_copied": 4096000
    },
    "dir16": {
      "files_discovered": 1000,
      "copied_new": 1000,
      "copied_replaced": 0,
      "skipped_same": 0,
      "skipped_diff": 0,
      "meta_fixed": 0,
      "failed": 0,
      "excluded": 0,
      "not_attempted": 0,
      "logical_bytes_discovered": 4096000,
      "logical_bytes_copied": 4096000
    },
    "dir17": {
      "files_discovered": 1000,
      "copied_new": 1000,
      "copied_replaced": 0,
      "skipped_same": 0,
      "skipped_diff": 0,
      "meta_fixed": 0,
      "failed": 0,
      "excluded": 0,
      "not_attempted": 0,
      "logical_bytes_discovered": 4096000,
      "logical_bytes_copied": 4096000
    },
    "dir18": {
      "files_discovered": 1000,
      "copied_new": 1000,
      "copied_replaced": 0,
      "skipped_same": 0,
      "skipped_diff": 0,
      "meta_fixed": 0,
      "failed": 0,
      "excluded": 0,
      "not_attempted": 0,
      "logical_bytes_discovered": 4096000,
      "logical_bytes_copied": 4096000
    },
    "dir19": {
      "files_discovered": 1000,
      "copied_new": 1000,
      "copied_replaced": 0,
      "skipped_same": 0,
      "skipped_diff": 0,
      "meta_fixed": 0,
      "failed": 0,
      "excluded": 0,
      "not_attempted": 0,
      "logical_bytes_discovered": 4096000,
      "logical_bytes_copied": 4096000
    }
  },
  "timeline": [
    {
      "seconds": 29.6353043,
      "read_mbps": 2.7642706145346105,
      "write_mbps": 2.7642706145346105,
      "files_per_second": 674.8707555016139,
      "hypothesis": "balanced"
    }
  ],
  "phases": {
    "fastest": {
      "seconds": 29.6353043,
      "read_mbps": 2.7642706145346105,
      "write_mbps": 2.7642706145346105,
      "files_per_second": 674.8707555016139,
      "hypothesis": "balanced"
    },
    "slowest": {
      "seconds": 29.6353043,
      "read_mbps": 2.7642706145346105,
      "write_mbps": 2.7642706145346105,
      "files_per_second": 674.8707555016139,